{
  "$schema": "sourcegraph-ai-ban-target-manifest.schema.json",
  "classifier_outcomes_consulted": false,
  "control_since": "2024-01-01",
  "eligible_repository_count": 14,
  "excluded_repository_count": 3,
  "exclusion_counts": {
    "no_frozen_ai_ban_candidate": 3
  },
  "exclusion_policy": [
    "direct_index_only",
    "missing_frozen_case",
    "missing_index_manifest_record",
    "missing_sg_evals_mirror",
    "no_frozen_ai_ban_candidate"
  ],
  "manifest_version": 3,
  "openai_api_key_used": false,
  "outcomes_consulted": false,
  "paid_api_used": false,
  "predecessors": {
    "case_index_file_sha256": "369145e65c6201e3782c8b35f42f667ca6fd122424babae24a5499596ed54cc4",
    "case_index_sha256": "8729186a45ca2b46cbe163b1069c3a6998e4cf5abcdcc63b3075c07592d1bf15",
    "control_evidence_file_sha256": "caefa0e4772ec67a7309ea433e149ec82311818075661cf55ed3b83a429a600e",
    "index_manifest_file_sha256": "eb39ec53d2cc73791f7ebef75a4226fdf67be0272017fed2d05ebbbe292b33b5",
    "packet_index_sha256": "ab92e8b06192f655553d4e58f03c97a4dd4f7fb32e354d254eb10fe0c75006ff",
    "specification_sha256": "16d40cc007a84fa92da01e2393f6ea65dc4870031487832d4147970f9d95bd3d",
    "workflow_sha256": "6e25e2283f0b85681016bc6c579fc4b40f222df4973ca6dc584ae85027c64361"
  },
  "repositories": [
    {
      "candidate_count": 9,
      "candidates": [
        {
          "candidate_event": {
            "commit_oid": "ae6a1b95857c7ba1392e37be99b9ee2b66b14b1d",
            "observed_at": "2022-03-24T02:00:25Z"
          },
          "event_id": "57d6f21a90f98c1b9d7b42ba950fef920a71174cc810c306d68af73aa3709814",
          "packet_count": 1,
          "packet_ids": [
            "54b26234953b90d50c5b2d6093fb005e250da31c90df979c6c2ac2036e9acb7e"
          ],
          "packet_type": "ai_ban_policy",
          "query_family_ids": [
            "ai_ban_policy_files"
          ]
        },
        {
          "candidate_event": {
            "commit_oid": "2dd5a2e3a1c0fad8441f8e9c7eb77315afcb075b",
            "observed_at": "2022-05-19T14:35:17Z"
          },
          "event_id": "7eebc2d838133a78a64a871c5ce0ecf91463bdde1d4647882ff758e3c6252865",
          "packet_count": 1,
          "packet_ids": [
            "c52fb43653dd2129c19646ec772c2e6319960ef888456f9c67cd7ade973e0643"
          ],
          "packet_type": "ai_ban_policy",
          "query_family_ids": [
            "ai_ban_policy_files"
          ]
        },
        {
          "candidate_event": {
            "commit_oid": "8aa0e7cd96a1e2f315d49744793ae07f6543ce4c",
            "observed_at": "2022-06-20T05:18:29Z"
          },
          "event_id": "95fa29a0338b42241a604f90572e28e5e46221269a1eb254c76e6dc8c03015cf",
          "packet_count": 1,
          "packet_ids": [
            "64454c6772a0074fc027453286df03c45f0d98d934a44b675fb43ec2f10f694f"
          ],
          "packet_type": "ai_ban_policy",
          "query_family_ids": [
            "ai_ban_policy_files"
          ]
        },
        {
          "candidate_event": {
            "commit_oid": "47ab66db0f083a76c7fba0f6e136b21dd5a93e3b",
            "observed_at": "2024-03-10T19:18:47Z"
          },
          "event_id": "dc173eea5407670b2439655f0ea0bf7e7adf1869c3b16dce4c03decbc86ce15a",
          "packet_count": 2,
          "packet_ids": [
            "b676af05ad33fe0159b51acf4980b20ab77017b7ed68e52460afe6a9e7d4c222",
            "be0f286e018035cae43bc09a321f5efe8c60ead9c37f532e47aa9ce2ef43d218"
          ],
          "packet_type": "ai_ban_policy",
          "query_family_ids": [
            "ai_ban_policy_files",
            "ai_ban_policy_introduction_diffs"
          ]
        },
        {
          "candidate_event": {
            "commit_oid": "2685654a37141cca63eda3a92da0e2706e23ccfd",
            "observed_at": "2025-05-18T01:45:26Z"
          },
          "event_id": "f9460b4d7909d78db066cb0b952c04abbe93b205fef0bc38735ea0a7e5088a5b",
          "packet_count": 2,
          "packet_ids": [
            "0ebe29c1a604247f800a297f08c7d0a5d7f348d104189cacf7fa64b515c30afc",
            "1cc0f2f7f8841f77b8772a1fbe2a837ac743693d0f3f0cb69865629ef0edfe7f"
          ],
          "packet_type": "ai_ban_policy",
          "query_family_ids": [
            "ai_ban_policy_files",
            "ai_ban_policy_introduction_diffs"
          ]
        },
        {
          "candidate_event": {
            "commit_oid": "6224a3898821965a7d6a2cb9cc2de40a0fd6e6bc",
            "observed_at": "2025-10-31T22:13:04Z"
          },
          "event_id": "0e783f7356921dc47eaa7d727d9d21888ca1e6de3e16406ed1cff077dd0fd082",
          "packet_count": 2,
          "packet_ids": [
            "5d96c4e2786a6cfda79be36b9b9ee30a5e957b667949f1e559e9101c8f716286",
            "824e85a9712e9ac348a1d39ff08dfc5a5cd7a97ae1af77a250b3fa215c730b8f"
          ],
          "packet_type": "ai_ban_policy",
          "query_family_ids": [
            "ai_ban_policy_files",
            "ai_ban_policy_introduction_diffs"
          ]
        },
        {
          "candidate_event": {
            "commit_oid": "f7acf3c1f42cc474927ecc452205d7877af36731",
            "observed_at": "2025-12-03T23:26:20Z"
          },
          "event_id": "e89c300c86dada80425afb36190f77c21561308a28e9edf0af462a7409a3503d",
          "packet_count": 1,
          "packet_ids": [
            "bce5445ec397d2396fd3ce782c251150dedd6d270e776fe7e8b7c81562703655"
          ],
          "packet_type": "ai_ban_policy",
          "query_family_ids": [
            "ai_ban_policy_introduction_diffs"
          ]
        },
        {
          "candidate_event": {
            "commit_oid": "7e145ac1cae8f891e18c9375fa23097f1dfa0b19",
            "observed_at": "2026-03-10T23:24:03Z"
          },
          "event_id": "f1ae30bcd8657c2dd16e5c8a1db5fc299b2d4c3aa2a471c0abe288aca109a425",
          "packet_count": 2,
          "packet_ids": [
            "4d89b8093a61348185eb8df0550dfa7800789a0ddcd56470e0cc99121f5ae6f7",
            "92a553512ba1af9b2745690696ae750349c8596d0c732252beb98ee52f743f8d"
          ],
          "packet_type": "ai_ban_policy",
          "query_family_ids": [
            "ai_ban_policy_files",
            "ai_ban_policy_introduction_diffs"
          ]
        },
        {
          "candidate_event": {
            "commit_oid": "249aa5d6e667308fbf95ae5cfb40eba8177a802c",
            "observed_at": "2026-07-01T18:27:40Z"
          },
          "event_id": "83114ed379b59b225b8de01614649ae780e5357852816bd4e88b9b5bdf615265",
          "packet_count": 3,
          "packet_ids": [
            "0e7c7316053587ed822c98904b31f60852ec1f9b001a30fe45da669a6a0e4cc0",
            "77b9bbac0f6e89795930f56910c5780cddcdbbf5490095cdae986b41d1debe15",
            "f4a70fce3425f623fc32fc64c8318b5a0a9a3e5db2da993e5ee78f824113b903"
          ],
          "packet_type": "ai_ban_policy",
          "query_family_ids": [
            "ai_ban_policy_files",
            "ai_ban_policy_introduction_diffs"
          ]
        }
      ],
      "canonical_repository_id": "yt-dlp/yt-dlp",
      "canonical_source_url": "https://github.com/yt-dlp/yt-dlp",
      "case_id": "c83eeeb61f7e449364e8ad7b9628e88da394a873bc37f43a5cd53d3f5d628049",
      "cutoff_commit": "fdcc954df4955267ec1627cbeb347b661a110e7c",
      "exclusion_reason": null,
      "preregistered_repository_id": "yt-dlp/yt-dlp",
      "repository_case_sha256": "803521410dd226f512acd15305e26440fb482b0db94b916b9a85693f3a72c03d",
      "sourcegraph_name": "github.com/sg-evals/yt-dlp-yt-dlp",
      "status": "eligible"
    },
    {
      "candidate_count": 1,
      "candidates": [
        {
          "candidate_event": {
            "commit_oid": "67eb48e6433beaab5b7472ceb190219d5b724149",
            "observed_at": "2026-02-19T19:11:57Z"
          },
          "event_id": "92a08b7ffb49377eb59cc8fdd945755886d818664dac7cadf28a60ba0baa45f2",
          "packet_count": 2,
          "packet_ids": [
            "7713d0c2cbc87e3a86f8db1ed09e5f897688998835d03d75b9202bd7fca10e34",
            "d2c08d5ecb68a417a80b6555bf1d05dc3411a6767b8870a9a9453d6d6db944bf"
          ],
          "packet_type": "ai_ban_policy",
          "query_family_ids": [
            "ai_ban_policy_files",
            "ai_ban_policy_introduction_diffs"
          ]
        }
      ],
      "canonical_repository_id": "borgmatic-collective/borgmatic",
      "canonical_source_url": "https://projects.torsion.org/borgmatic-collective/borgmatic",
      "case_id": "b274b5767a2531fa9496f435e6925e5453a095ff125e5ec3f82e3f2c644691a4",
      "cutoff_commit": "dbc3fc356ce58a1a8a37422b387ca22f7b3a651b",
      "exclusion_reason": null,
      "preregistered_repository_id": "borgmatic-collective/borgmatic",
      "repository_case_sha256": "515a57e84c2c54826d89223026ecffcfdb9bfef453dbd40b3d58613be8a6e261",
      "sourcegraph_name": "github.com/sg-evals/borgmatic-collective-borgmatic",
      "status": "eligible"
    },
    {
      "candidate_count": 1,
      "candidates": [
        {
          "candidate_event": {
            "commit_oid": "c41effcbc6e91ad800be15bd83f1f9ea58cff275",
            "observed_at": "2026-03-22T18:38:08Z"
          },
          "event_id": "9f5d07bbeba95f21c8cc3ebf71550feab127bcd164f9a448df17aa51e24a2263",
          "packet_count": 2,
          "packet_ids": [
            "aa775fca45913495a1e5a44278c4bd6cca2f7d5ce207a5970696e0847939ab80",
            "ebe1105034b76362ffff54476c55b7e4d705d862489f0c4bd70e3f5fbc619742"
          ],
          "packet_type": "ai_ban_policy",
          "query_family_ids": [
            "ai_ban_policy_files",
            "ai_ban_policy_introduction_diffs"
          ]
        }
      ],
      "canonical_repository_id": "poezio/poezio",
      "canonical_source_url": "https://codeberg.org/poezio/poezio",
      "case_id": "fee9dc27633a2732163b80e28f2a38e19c3df051c4e35de78829e376ef8aa22b",
      "cutoff_commit": "9c528ac2f3e2cdad01b8c72dbcebbdd37c38fef5",
      "exclusion_reason": null,
      "preregistered_repository_id": "poezio/poezio",